{
  "$schema": "../hashi.config.schema.json",
  "channels": {
    "status": "1228631187459670046"
  },
  "intents": 0,
  "database": {
    "addressFamily": "IPv4",
    "connectionURI": "mongo://localhost:27017/",
    "databaseName": "hashi-plate"
  },
  "defaultFeatures": ["Command:help", "Command:ping", "Event:commands"],
  "envPath": "./.env",
  "projectName": "MarikoBot-Hashi"
}
